"Zeitstempel (UTC)","Region","Ticker","Handlung","Sentiment","Alter (Min)","Quelle","Original-Quelle","Zusammenfassung","KI-Modell"
"2026-05-11 22:10:19","CRYPTO","BTC","KAUFEN","0.85","0","theblock.co","https://vertexaisearch.cloud.google.com/grounding-api-redirect/AUZIYQGExkPSJtuFPwmoCQctkN-TPwV010ueicLO-Wp1HXJXM-7yFyEWMZQQfBT57ElGZjTQD2lgvcOKF61yyzUes6KfhYbZy3pKmPzutqCMW8ud_82p2M8seHyAMlzabCqWGswjfs9DREjuxaika0OspGYg8wonWzFiA60Q-WDtHA==","ANALYSE: US-Spot-Bitcoin-ETFs verzeichneten im April und Anfang Mai erhebliche Nettozuflüsse von insgesamt Milliarden US-Dollar, was auf eine starke institutionelle Nachfrage hindeutet und das verfügbare Angebot an Bitcoin verknappt. Allein im April betrugen die Nettozuflüsse rund 1,9 Milliarden US-Dollar, der stärkste Monat seit Oktober 2025, und die kumulierten Zuflüsse seit der Einführung der Produkte im Jahr 2024 liegen bei fast 58 Milliarden US-Dollar. Dies führte zu neun aufeinanderfolgenden Tagen von Nettozuflüssen bis Anfang Mai, die etwa 2,7 Milliarden US-Dollar ausmachten und schätzungsweise 33.000 bis 35.000 BTC vom handelbaren Angebot entfernten. Bitcoin notiert derzeit nahe 82.000 US-Dollar.
RELEVANZ: Diese anhaltenden und substanziellen Kapitalzuflüsse in Bitcoin-ETFs signalisieren ein wachsendes institutionelles Interesse und eine erhöhte Akzeptanz von Bitcoin als Anlageklasse, was den Preis stützen und potenziell weiter nach oben treiben könnte. Die Verknappung des Angebots durch diese Zuflüsse verstärkt den positiven Preisanreiz.
ERKLÄRUNG FÜR ANFÄNGER: Stell dir vor, viele große Investoren (wie große Fonds) kaufen über spezielle Anlageprodukte (ETFs) sehr viel Bitcoin. Wenn viele Leute etwas kaufen wollen und es weniger davon gibt, steigt normalerweise der Preis. Das ist ein gutes Zeichen für Bitcoin, da es zeigt, dass immer mehr große Geldgeber an die Zukunft von Bitcoin glauben.","gemini-2.5-flash"
"2026-05-11 23:12:21","ASIA","FXI","KAUFEN","0.7","720","reuters.com","https://vertexaisearch.cloud.google.com/grounding-api-redirect/AUZIYQE4Nxvzu5vrHrC4gI1eRRwzJsgn-zXHPpSzOt3OqYVLY3NtK2QQHoCA9qmAdBwbS-E2v3hdrzrhVRYBNF34_BphBmmR-pVIdRMgmLFUZywKWu7-btVUNth6Z-DfgxPXntpJjNK4rO4=","ANALYSE: Chinesische Aktien erreichten am 11. Mai 2026 Elfjahreshochs, und der Yuan erreichte ein Dreijahreshoch gegenüber dem US-Dollar. Dies wurde durch über den Erwartungen liegendes Exportwachstum und die höchste Erzeugerpreisinflation Chinas seit über drei Jahren angetrieben. Ein bevorstehender Trump-Xi-Gipfel könnte Pekings Verhandlungsposition stärken. RELEVANZ: Starke Wirtschaftsdaten und steigende Aktienmärkte in China signalisieren eine robuste Wirtschaftserholung und erhöhtes Anlegervertrauen, was sich positiv auf chinesische Aktien-ETFs auswirken kann. ERKLÄRUNG FÜR ANFÄNGER: Die chinesische Wirtschaft läuft sehr gut, mit vielen Exporten und steigenden Preisen, was bedeutet, dass die Unternehmen mehr Geld verdienen. Das macht chinesische Aktien für Anleger attraktiver, ähnlich wie wenn ein Unternehmen gute Geschäftszahlen vorlegt.","gemini-2.5-flash"
"2026-05-12 00:14:21","USA","SPY","VERKAUFEN","-0.7","0","Reuters","https://vertexaisearch.cloud.google.com/grounding-api-redirect/AUZIYQE4IsyB9IXkgxA5xfzIT8aS563eA0IxQkERXqiWP3YWaGErf5cgHRNNxGHJmxCxCLbMYMoeAMM2thMQFCsf51Q9rBg8S-w1tQaP4ZFJJkaXxwGLjv7mwgfMLizQdbyKcj303IZYUhZBoSgk9LjdxPTPvWU-kuyBeb00ZN94QfXA_giGc0pUJk2DRgTtYlKajQSBmPhBrQW71znGubeVBHxaLdzlInJIWFcOYnIphzoB8J6js0nhuVc=","Die US-Inflation wird im April voraussichtlich deutlich ansteigen, hauptsächlich getrieben durch höhere Energiepreise infolge des Nahostkonflikts. Große Banken wie BofA und Goldman Sachs haben ihre Erwartungen für Zinssenkungen der Federal Reserve nach hinten verschoben, wobei einige nun keine Senkungen mehr im Jahr 2026 erwarten. Dies liegt an der anhaltend hohen Inflation und einem starken Arbeitsmarkt. Dies deutet auf eine restriktivere Geldpolitik in den USA hin. Für nicht finanzbewanderte Menschen bedeutet das: Die Preise in den USA steigen voraussichtlich stärker als gedacht, vor allem wegen teurerer Energie durch den Nahostkonflikt. Das bedeutet, dass die US-Notenbank (Fed) die Zinsen wahrscheinlich länger hochhalten wird, was schlecht für die Wirtschaft und die Aktienmärkte sein könnte. Große Banken erwarten jetzt, dass die Zinsen erst viel später gesenkt werden.","gemini-2.5-flash"
"2026-05-12 04:10:08","ASIA","EWA","VERKAUFEN","-0.7","0","RBA","https://vertexaisearch.cloud.google.com/grounding-api-redirect/AUZIYQHPQ_sxGbOINJ1rf0LuvTvFfdSr0Z8K-AqFuTgzwtPOFsIPsxbMLOpKs8j_DOkD5K85_XSXlj0Cm5gi-n9I3IwybxbFExhxZGJ-8RsUdsQ6Kl9RdqO9QfYhzz9Ur0ewieSWu3NnViooga7JKQ==","Die Reserve Bank of Australia (RBA) hat auf ihrer Mai-Sitzung den Leitzins um 25 Basispunkte auf 4,35 % erhöht, um die hartnäckig hohe Inflation zu bekämpfen. Die Inflation wird voraussichtlich noch einige Zeit über dem Zielbereich von 2-3 % bleiben, angetrieben durch höhere Kraftstoffpreise und den Konflikt im Nahen Osten. Die Ausgaben in der Wirtschaft sollen sich verlangsamen, und die Arbeitslosenquote wird voraussichtlich leicht ansteigen. Für nicht finanzbewanderte Menschen bedeutet dies, dass das Leihen von Geld in Australien teurer wird, was die Wirtschaft bremsen und Dinge wie Kredite und Hypotheken für Verbraucher verteuern kann, um die Preissteigerungen einzudämmen.","gemini-2.5-flash"
"2026-05-12 06:50:08","CRYPTO","BTC","VERKAUFEN","-0.6","409","MEXC News","https://vertexaisearch.cloud.google.com/grounding-api-redirect/AUZIYQHwiKwR9IZLjcbfyAAOk7iM5YY9lH399rDP4KnxwvjcYj9B-agAIrULSaYa07_5pAVEeMu3FcFJv0e3BPWE6odDe7V87hqk8gINJB0_a8XfZ1fXCQQD3os-kJts-g==","In den letzten 24 Stunden kam es zu massiven Liquidationen im Kryptomarkt, mit insgesamt fast 410 Millionen US-Dollar an liquidierten Long- und Short-Positionen. Dies deutet auf eine hohe Volatilität und eine Phase der Deleveraging hin, bei der gehebelte Positionen zwangsweise geschlossen wurden. Für Nicht-Finanzexperten bedeutet dies, dass viele Anleger, die mit geliehenem Geld auf steigende oder fallende Kryptopreise gewettet haben, ihre Positionen schließen mussten, weil sich der Markt stark in die unerwartete Richtung bewegt hat. Das zeigt, dass der Kryptomarkt gerade sehr unruhig ist.","gemini-2.5-flash"
"2026-05-12 09:28:36","ASIA","FXI","KAUFEN","0.7","567","english.news.cn","https://vertexaisearch.cloud.google.com/grounding-api-redirect/AUZIYQFF_KhQArzigG5zSzTiFkWw7PDNpG469fI7QSfQbzP5n-e2fvkUr_e4s2WBQIKZivDtanCqkN0vIxInkAR5_e8-kizHoHF1Xc07SJ0f55duJK7Mdy_qKi68z4OCP-Z9QQEUHm5_m2yVJxUaxUw=","ANALYSE: Chinas Verbraucherpreisindex (CPI) stieg im April 2026 um 1,2% gegenüber dem Vorjahr, was eine Beschleunigung gegenüber dem Vormonat darstellt. Dies wurde hauptsächlich durch eine robuste Reisenachfrage und höhere Energiepreise angetrieben. Gleichzeitig erhöhte sich der Erzeugerpreisindex (PPI) im Jahresvergleich um 2,8%. RELEVANZ: Diese Daten deuten auf eine Verbesserung der Binnennachfrage und eine fortgesetzte wirtschaftliche Erholung in China hin. Die steigenden Verbraucher- und Erzeugerpreise können die Unternehmensgewinne stützen und sind generell positiv für die chinesische Wirtschaft, was sich auf die asiatischen Märkte auswirken könnte. ERKLÄRUNG FÜR ANFÄNGER: Stell dir vor, die Preise für Dinge, die du kaufst, wie Essen oder Reisen, sind in China im April etwas stärker gestiegen. Das liegt daran, dass die Leute wieder mehr unterwegs waren und Energie teurer wurde. Auch die Preise, die Fabriken für ihre Produkte verlangen, sind gestiegen. Das ist ein gutes Zeichen, denn es zeigt, dass die Wirtschaft in China wieder in Schwung kommt und die Menschen mehr Geld ausgeben.","gemini-2.5-flash"
"2026-05-12 11:33:19","CRYPTO","XRP","IGNORIEREN","0.7","1790","MEXC Exchange","https://vertexaisearch.cloud.google.com/grounding-api-redirect/AUZIYQFUSoyD1IwBLvEPLIgHFx0_428gbRJwRpqEes1jV0cL0BJKCxKqRLnfsLtfjBiH43pk9DyvJ7oXZ5egdAUYC9BUNW36aQNLZCvuXMMeW12BO03PfI4SRn7zwoEuAuGpk2VYOGe4Ki8JSo5hPQ==","ANALYSE: XRP-ETFs verzeichneten in der Woche vom 11. Mai 2026 Zuflüsse von 55 Millionen US-Dollar, was die stärkste Woche des Jahres 2026 darstellt und auf eine steigende institutionelle Nachfrage hindeutet. Dies ist ein positives Zeichen für die Akzeptanz von XRP durch große Investoren.
EINFACHE ERKLÄRUNG: Große Investoren haben viel Geld in spezielle Fonds gesteckt, die an die Kryptowährung XRP gebunden sind. Das zeigt, dass immer mehr große Finanzfirmen XRP für sich entdecken und daran glauben.","gemini-2.5-flash"
"2026-05-12 13:26:52","NONE","NONE","IGNORIEREN","0.0","0","NONE","Keine Web-URL indiziert","ANALYSE: Für den Zeitraum vom 11. bis 12. Mai 2026 wurden keine signifikanten, kursrelevanten Eilmeldungen, makroökonomischen Daten oder politischen Treiber von den ausschließlich zugelassenen Whitelist-Quellen gefunden. Der Markt zeigt sich aus dieser Perspektive ruhig. + ERKLÄRUNG FÜR ANFÄNGER: Es gab keine großen Nachrichten von den wichtigen Finanzseiten, die den Markt stark bewegen könnten. Alles scheint im Moment ruhig zu sein.","gemini-2.5-flash"
"2026-05-12 18:16:10","USA","SPY","VERKAUFEN","-0.7","375","washingtonpost.com","https://vertexaisearch.cloud.google.com/grounding-api-redirect/AUZIYQGOLuu3nUTO4L0RHESM7lL6Mf0ahYxIdcmW9GMN2zky8bfGHTmkOkaH8aN01eqQWiZn6LasiUmBKM3GLjz3gs-4jp9Cs_5VouW4kuJLyjDUfnMusl7hBzrSNg55Jz2KwvUciqtaLHGQYdXHU3VtMjJ2qBQL2Km71RJZ8WbhHbEePNvyfnjWDwnQDPkmJRY7O61JFQ==","ANALYSE: Die US-Inflation ist im April auf 3,8 % gestiegen, den höchsten Stand seit Mai 2023, angetrieben durch stark gestiegene Energiepreise infolge des Iran-Krieges. Die Kerninflation stieg ebenfalls auf 2,8 %. Diese Daten waren höher als von Ökonomen prognostiziert und machen baldige Zinssenkungen der Federal Reserve unwahrscheinlich, was sich negativ auf die Aktienmärkte auswirkt. ERKLÄRUNG FÜR ANFÄNGER: Die Preise für viele Dinge in den USA sind im April stärker gestiegen als erwartet, vor allem weil Benzin und andere Energieträger durch den Krieg im Iran teurer geworden sind. Das bedeutet, dass die US-Zentralbank die Zinsen wahrscheinlich länger hochhalten wird, um die Preissteigerungen zu bremsen. Höhere Zinsen machen Kredite teurer und sind normalerweise schlecht für Aktien.","gemini-2.5-flash"
"2026-05-12 20:12:24","USA","SPY","VERKAUFEN","-0.7","120","Bloomberg","https://vertexaisearch.cloud.google.com/grounding-api-redirect/AUZIYQET7cvkTJQ9JOJ5_JITSClrviNRA3cjhQAF7CXbJIVhesig7jwhlr4JdJvJFgeDvi0QSlP0mBSiFQNscl9Cy7O4hcm0Fzs56Turc04Y1ngdf-gpGUJhRvp7TzyVuOcyKHsb6C69ROzFiS6jwunrdFZ-4PI8nYx3B0ODqdNOwA3w1GpayA51aAXiDA5GGgQBNT0JbLhHYbYqgQ4MacaXlSAHrHUS-94tDVbbMgIzQg==","ANALYSE: Die US-Inflation hat im April 2026 mit einem Anstieg des Verbraucherpreisindex (CPI) um 3,8% im Jahresvergleich die schnellste Rate seit 2023 erreicht. Die Kerninflation, welche Lebensmittel und Energie ausschließt, stieg um 2,8% im Jahresvergleich. Diese Beschleunigung ist hauptsächlich auf höhere Benzinpreise (teilweise bedingt durch den Iran-Krieg), sowie gestiegene Kosten für Lebensmittel, Flugreisen und Hotels zurückzuführen. Große Wall-Street-Banken wie Goldman Sachs und Bank of America verschieben ihre Erwartungen für Zinssenkungen der Federal Reserve nach hinten, da die Inflation hartnäckig bleibt und die US-Wirtschaft robust ist. Die Renditen von US-Staatsanleihen sind am Montag, dem 11. Mai, über alle Laufzeiten hinweg gestiegen, was auf eine Erwartung längerfristig höherer Zinsen hindeutet. RELEVANZ: Diese Entwicklungen erhöhen den Druck auf die Federal Reserve, ihre restriktive Geldpolitik beizubehalten oder sogar zu verschärfen, was die Kreditkosten für Unternehmen und Verbraucher erhöht und das Wirtschaftswachstum bremsen könnte. Dies ist tendenziell negativ für Aktienmärkte. ERKLÄRUNG FÜR ANFÄNGER: Wenn die Preise für Waren und Dienstleistungen (Inflation) schnell steigen, versucht die US-Zentralbank (die Fed), dies zu bremsen, indem sie das Geld teurer macht (Zinsen hochhält). Da die Preise jetzt noch schneller steigen als erwartet, müssen die Zinsen wahrscheinlich länger hoch bleiben. Das ist schlecht für Unternehmen, weil sie teurer Kredite aufnehmen müssen, und auch für Verbraucher, die zum Beispiel einen Hauskredit wollen. Für den Aktienmarkt bedeutet das oft, dass die Kurse fallen könnten, weil die Aussichten für die Wirtschaft und die Unternehmensgewinne schlechter werden.","gemini-2.5-flash"
"2026-05-12 21:43:49","ASIA","FXI","VERKAUFEN","-0.8","2262","finanzen.net","https://vertexaisearch.cloud.google.com/grounding-api-redirect/AUZIYQFp-R0bj6V-HcenA1MpGbRCBoYzs9ET0Iycii5DhSkHnvQO_8KlVoZkOldYGb4ABddwkYYdlUtv95pS8njmwDlXHgZTOx27vcaiOnJ_5AtVGynzEKBkx97HDBxqUdvKe2qYJ6vZWPGWxn2zBhJ0Cgl3V3Vq6KN1X4kNdE_XZPLNJXIS_0-TVzB5KffAX538jWxA1MJK6kiUls2_MC7Z3nZM84_w4bXnobqEbRTmtgsrTPEe-A==","ANALYSE: Die asiatischen Aktienmärkte erlebten am 11. Mai 2026 einen kräftigen Absturz, wobei der japanische Leitindex Nikkei 225 um 3,68 % und der koreanische Leitindex KOSPI um 6,49 % fielen. Dieser Rückgang wurde durch die Drohung des Iran ausgelöst, die Meerenge von Hormus monatelang zu sperren, was zu erheblicher geopolitischer Unsicherheit führte. Trotz des breiten Ausverkaufs zeigten koreanische Privatanleger laut Bloomberg eine ungewöhnliche Kaufaktivität in heimischen Aktien. RELEVANZ: Geopolitische Spannungen im Nahen Osten, insbesondere die Bedrohung wichtiger Schifffahrtsrouten, können globale Lieferketten und Energiepreise massiv beeinflussen. Dies wirkt sich direkt auf die exportorientierten asiatischen Volkswirtschaften aus und schafft ein erhebliches Gap-Risiko für die nächste Markteröffnung. EINFACHE ERKLÄRUNG: Wenn es in einer wichtigen Region der Welt (Naher Osten) zu ernsten politischen Problemen kommt, die den Handel stören könnten (Iran droht, eine wichtige Meerenge zu blockieren), werden Anleger weltweit nervös. Sie verkaufen Aktien, besonders in Asien, da viele asiatische Länder stark vom internationalen Handel und stabilen Rohstoffpreisen abhängen. Der starke Kursfall zeigt die Angst vor wirtschaftlichen Folgen.","gemini-2.5-flash"
"2026-05-12 22:49:39","ASIA","EWJ","IGNORIEREN","-0.5","120","Trading Economics","https://vertexaisearch.cloud.google.com/grounding-api-redirect/AUZIYQGxYGyrwJgj6P05tE0jBmLk9Yvhuunxb6TYV24guAjjMrfOcmIEZIQAFdDpoHw8XeL4V3TiN6hc0UKU7owErcsNyg8cNKplLzIgVCOCbaHi2baPDMFyFI68RRpt0s2jhmRKKA==","ANALYSE: Die Bank of Japan signalisiert eine mögliche Zinserhöhung bereits auf ihrer nächsten Sitzung, angetrieben durch steigende Ölpreise und Inflationsrisiken. Dies hat die Rendite 10-jähriger japanischer Staatsanleihen auf ein 29-Jahres-Hoch von rund 2,55 % getrieben. Obwohl Japans Frühindikator für die Wirtschaft im März 2026 auf den höchsten Stand seit April 2022 gestiegen ist und die Exporte aufgrund der KI-Nachfrage den siebten Monat in Folge zunahmen, hat sich der Arbeitsmarkt entspannt und das Verbrauchervertrauen geschwächt. Der japanische Yen hat gegenüber dem US-Dollar nachgegeben, nachdem US-Präsident Donald Trump Zweifel am Waffenstillstand zwischen den USA und dem Iran geäußert hatte. In China erreichten die Aktienmärkte 11-Jahres-Höchststände und der Yuan ein 3-Jahres-Hoch gegenüber dem Dollar, unterstützt durch über den Erwartungen liegendes Exportwachstum und die höchste Erzeugerpreisinflation seit über drei Jahren, was Chinas Position vor einem bevorstehenden Gipfeltreffen mit Trump stärken könnte. In den USA wird die Inflation laut TS Lombard voraussichtlich bei etwa 3 % verharren, da die Kernbereiche Dienstleistungen, Energie und Güter weiterhin Preisdruck zeigen, was die Hoffnung auf schnelle Zinssenkungen der Federal Reserve dämpft. Geopolitische Spannungen tragen ebenfalls zu höheren Energie- und Lebensmittelpreisen bei. Im Kryptomarkt bewegt sich Bitcoin nahe der 82.000-Dollar-Marke, angetrieben durch anhaltende institutionelle Zuflüsse in Krypto-ETFs (hauptsächlich Futures-ETFs, da Spot-Bitcoin-ETFs in den USA noch nicht von der SEC genehmigt sind) und eine verbesserte regulatorische Stimmung in den Vereinigten Staaten.

EINFACHE ERKLÄRUNG: Japans Zentralbank überlegt, die Zinsen bald zu erhöhen, weil die Preise steigen, besonders für Öl. Das macht das Leihen von Geld teurer, zeigt aber auch, dass die Wirtschaft in einigen Bereichen wächst, auch wenn der Arbeitsmarkt etwas schwächer ist. Gleichzeitig geht es Chinas Wirtschaft sehr gut, die Börse ist auf einem Hoch und die Währung ist stark. In den USA bleiben die Preise hoch, was bedeutet, dass die US-Zentralbank die Zinsen wahrscheinlich nicht so schnell senken wird. Auch politische Spannungen im Nahen Osten lassen die Energiepreise steigen. Bei Kryptowährungen wie Bitcoin gibt es viel Interesse von großen Firmen, was den Preis hochtreibt, obwohl bestimmte Bitcoin-Fonds in den USA noch nicht offiziell zugelassen sind.","gemini-2.5-flash"
"2026-05-12 23:47:04","USA","SPY","VERKAUFEN","-0.8","676","Bloomberg","https://vertexaisearch.cloud.google.com/grounding-api-redirect/AUZIYQG1U0_FQ2FN8hbEhPqQh7jYFqWnaN_pQN13J-IMMr4bHwO02vvScZYU0f-PFtZI1xCUxBxdItheZZQmdJHCYe5yAPVOaQNVfoWiYUEKHLa5_vaTdkPuFEcpQgPRqRfiGM86NSZxrlku9pvtJY2DUir5rxE3GwsgknF3PFXyTZV3ditiu-rMHvE3qIAA3DfldRKvvZNiUsemPktSAWbLJUqKsg2ZwqX8WhvXUDfvBM0=","ANALYSE: Die US-Verbraucherpreise (CPI) sind im April 2026 im Jahresvergleich um 3,8 % gestiegen, der schnellste Anstieg seit 2023, und monatlich um 0,6 %. Die Kerninflation (ohne Nahrungsmittel und Energie) stieg monatlich um 0,4 % und jährlich um 2,8 %. Dieser Anstieg ist hauptsächlich auf höhere Benzinpreise (bedingt durch den Iran-Krieg), Lebensmittel und Flugpreise zurückzuführen. RELEVANZ: Diese Beschleunigung der Inflation erhöht den Druck auf die Federal Reserve, ihre restriktive Geldpolitik beizubehalten oder Zinssenkungen zu verschieben, was tendenziell negativ für Aktienmärkte ist. Aktienfutures und Staatsanleihen reagierten bereits mit Kursverlusten. ERKLÄRUNG FÜR ANFÄNGER: Stell dir vor, die Preise für Dinge, die du täglich kaufst, wie Benzin und Lebensmittel, steigen schneller als erwartet. Das bedeutet, dass dein Geld weniger wert ist. Wenn das passiert, muss die US-Zentralbank (die Fed) möglicherweise die Zinsen hochhalten, um die Preise zu beruhigen. Höhere Zinsen machen es für Unternehmen und Privatpersonen teurer, Geld zu leihen, was schlecht für die Wirtschaft und die Aktienkurse sein kann.","gemini-2.5-flash"
"2026-05-13 01:33:34","CRYPTO","BTC","VERKAUFEN","-0.7","720","coinmarketcap.com","https://vertexaisearch.cloud.google.com/grounding-api-redirect/AUZIYQGg54IrJ_ZaecT7oSSr8kaQ0ZvBB18fQhjqP4j2VKoVz8HNQmq7JI23DkyFQzBWcMSCvXVLPVK61y5Baj0BuNXfFc1_v4PCxQRq3BY3hnQJ19wEI_4VrrdRC-SGkx0yn1qu","Die US-Inflationsdaten für April 2026 fielen höher aus als erwartet, was eine 'Risk-Off'-Stimmung am Kryptomarkt auslöste. Dies führte dazu, dass Altcoins wie Stacks (STX) fielen, da Anleger risikoreichere Anlagen reduzierten. Obwohl Bitcoin nicht direkt mit einer prozentualen Veränderung in diesem spezifischen Snippet genannt wird, ist es die Leitwährung und reagiert typischerweise auf solche makroökonomischen Daten. Für Nicht-Finanzexperten bedeutet das: Wenn die Preise in den USA stärker steigen als gedacht, werden Anleger vorsichtiger und ziehen ihr Geld aus risikoreichen Anlagen wie Kryptowährungen ab, was deren Preise sinken lässt.","gemini-2.5-flash"
"2026-05-13 05:33:56","EUROPE","EZU","VERKAUFEN","-0.7","1143","reuters.com","https://vertexaisearch.cloud.google.com/grounding-api-redirect/AUZIYQF5SKdgY3EY2q4MBdfYllQBks6i3RR6J8BoZtSnCd-hDorWZGMSpBJ1MjTzXv5YsM3RaadYIFOFQqu-PYI4FQUPwbL2VXqlbXykqkV7arT0UcVicpS2CclkCoW9KGIC5c46UkikLeuMS-98saGnh4JjDeiOOghECjSljlsoN232EXvB68naA4SnjK8G21uVeiTzBllegUzrERysLsvJ","ANALYSE: Die europäischen Aktienmärkte, repräsentiert durch Indizes wie den Stoxx Europe 600, den Euro Stoxx 50 und den DAX, verzeichneten am 12. Mai 2026 einen Rückgang. Dies ist primär auf die höher als erwarteten US-Inflationsdaten für April (3,8% gegenüber erwarteten 3,7%) zurückzuführen, die Bedenken hinsichtlich einer restriktiveren Geldpolitik der Zentralbanken verstärken. Zusätzlich trugen schwindende Hoffnungen auf ein Friedensabkommen zwischen den USA und dem Iran zur negativen Stimmung bei. EZB-Ratsmitglied Joachim Nagel signalisierte zudem, dass Zinserhöhungen der EZB aufgrund der Inflationsaussichten und des Iran-Krieges wahrscheinlicher werden.
ERKLÄRUNG FÜR ANFÄNGER: Stell dir vor, die Preise in den USA steigen schneller als erwartet. Das macht Anlegern Sorgen, dass die Zentralbank die Zinsen erhöhen muss, um die Preise zu bremsen. Höhere Zinsen sind schlecht für Unternehmen, weil Kredite teurer werden und die Leute weniger Geld ausgeben. Deshalb sind die Aktienkurse in Europa gefallen. Auch politische Spannungen im Nahen Osten tragen zur Unsicherheit bei.","gemini-2.5-flash"
"2026-05-13 08:22:58","USA","SPY","VERKAUFEN","-0.7","862","The Washington Post","https://vertexaisearch.cloud.google.com/grounding-api-redirect/AUZIYQGbMlFn1-j4SxWx32E4KIP3ccH7PwDPzDwu23wxmjcLesBJPyHQJJ0LDYe5WzdxfXAWA0wmzceCqOUA-30dlDW35ZRsSa0xrVaEois9EmlxLTtu8ZKtnJ_tseVHZSGlRQVVf9c5wx0P7VB0HyXiDt_oFP8OOikHU1ZTJMOl14UVhQ77uRf_JJfRYneBDJHHjaFGO8JZSykQB6IryGRBux59Ubp1_g==","Die US-Inflationsdaten für April 2026 zeigen einen Anstieg des Verbraucherpreisindex (CPI) um 3,8% im Jahresvergleich, hauptsächlich angetrieben durch höhere Energiekosten. Der Kern-CPI stieg um 0,4% im Monatsvergleich und 2,8% im Jahresvergleich, was deutlich über dem 2%-Ziel der Federal Reserve liegt. Kevin Warsh steht kurz vor der Bestätigung als neuer Fed-Vorsitzender. Die Fed steht unter politischem Druck, Zinssenkungen vorzunehmen, jedoch wäre eine Lockerung der Geldpolitik bei einer Inflation von fast 4% als katastrophal für die Kaufkraft der Amerikaner anzusehen. Dies deutet auf anhaltenden Inflationsdruck und eine wahrscheinliche restriktive Haltung der Fed hin.

*Einfache Erklärung für Anfänger:*
Die Preise in den USA sind im April stark gestiegen, besonders für Energie. Das bedeutet, dass das Leben für die Menschen teurer wird. Die US-Notenbank (Fed) muss nun entscheiden, wie sie darauf reagiert, um die Preise wieder stabiler zu machen. Obwohl es politischen Druck gibt, die Zinsen niedrig zu halten, ist es unwahrscheinlich, dass die Fed dies tun wird, da dies die Inflation noch verschlimmern könnte. Das könnte bedeuten, dass die Zinsen nicht so schnell sinken, wie manche hoffen, was schlecht für Aktien sein kann.","gemini-2.5-flash"
"2026-05-13 11:07:10","USA","SPY","VERKAUFEN","-0.7","1356","theguardian.com/business","https://vertexaisearch.cloud.google.com/grounding-api-redirect/AUZIYQHME345iTG1a5HQp2w51hP6XG_ph1loWAT3sv1BRGQhpV2uDHH72K-LJTBH77ayQMcYQBhoE0BNFqfl6Iuu5er0mpKtJsrrrrHiW-Auy4caAvqnyc-LPNnTypM-H6fUGNm8BibhggA9J3mbiQRteGbHckish0eFR1Qsz-d16M_iHS1SnzLvFZM=","ANALYSE: Die US-Inflation ist im April 2026 auf 3,8 % gestiegen, verglichen mit 3,3 % im März, und erreichte damit den höchsten Stand seit 2023. Dieser Anstieg wird hauptsächlich auf den Krieg im Nahen Osten und die damit verbundenen Energiepreise zurückgeführt. Der designierte Fed-Vorsitzende Kevin Warsh, der sich für niedrigere Zinsen ausspricht, könnte durch die steigende Inflation in seiner Position erschwert werden. Die aktuellen Fed-Zinssätze liegen zwischen 3,5 % und 3,75 %.
RELEVANZ: Eine höhere Inflation als erwartet erhöht den Druck auf die Federal Reserve, ihre restriktive Geldpolitik beizubehalten oder sogar zu verschärfen, was sich negativ auf Aktienmärkte und das Wirtschaftswachstum auswirken könnte.
EINFACHE ERKLÄRUNG: Stell dir vor, alles wird teurer, viel schneller als erwartet. Das ist Inflation. Wenn das passiert, muss die Zentralbank (die Fed) normalerweise die Zinsen erhöhen, damit die Leute weniger Geld ausgeben und die Preise wieder sinken. Aber höhere Zinsen sind schlecht für Unternehmen und die Wirtschaft, weil Kredite teurer werden. Das ist wie eine Bremse für die Wirtschaft.","gemini-2.5-flash"
