"Zeitstempel (UTC)","Region","Ticker","Handlung","Sentiment","Alter (Min)","Quelle","Original-Quelle","Zusammenfassung","KI-Modell"
"2026-05-13 13:27:55","USA","SPY","VERKAUFEN","-0.6","206","Pittsburgh Post-Gazette","https://vertexaisearch.cloud.google.com/grounding-api-redirect/AUZIYQGzF5UiFFT0x_b39WKBspYR3Sc-1qJ8b-jNzSQ1AXqG5C_fuMPJjIVQWoOUwlnN9Bsr1TOJSCCQ_Z6PmT8H_DMPuKRk2o3UxxYW2VK4H9Isv1Zmt-1fhyzrphhUxZ8JWDYq4_75bIcoaNW9wByx85_NUlRaUawgPpxrpoYrJlR37ZLFYH2M-KZQqDcfUS6WdWorQZbeKuIB006aTTEEGhh0hOnZpWk=","ANALYSE: Die US-Inflation hat sich im April stärker als erwartet verschlechtert, was die Erwartungen an die Geldpolitik der Federal Reserve beeinflusst. Der Verbraucherpreisindex (CPI) stieg im April um 0,6% im Monatsvergleich und um 3,8% im Jahresvergleich. Auch die Kerninflation (ohne Nahrungsmittel und Energie) erhöhte sich um 0,4% monatlich und 2,8% jährlich. Diese hartnäckige Inflation, verstärkt durch steigende Ölpreise aufgrund der Spannungen zwischen den USA und dem Iran, führt dazu, dass Händler eine längere Beibehaltung hoher Zinsen durch die Fed oder sogar eine Zinserhöhung bis Dezember für wahrscheinlicher halten. Die Fed hat in diesem Jahr bisher keine Zinssenkungen vorgenommen. Obwohl der Technologiesektor im Premarket am Mittwoch eine Erholung zeigte, mit einem Anstieg der Nasdaq-Futures um 0,7%, waren die breiteren Märkte gemischt, was die Unsicherheit widerspiegelt. + RELEVANZ: Höhere Inflation und die Aussicht auf längerfristig hohe Zinsen oder sogar eine Zinserhöhung sind tendenziell negativ für den Aktienmarkt, da sie die Kreditkosten für Unternehmen erhöhen und die Konsumausgaben dämpfen können. Die gemischte Reaktion im Premarket zeigt jedoch, dass der Markt verschiedene Faktoren abwägt. + EINFACHE ERKLÄRUNG: Stell dir vor, alles wird teurer (Inflation). Wenn das passiert, muss die Zentralbank (Fed) normalerweise die Zinsen hochhalten oder sogar erhöhen, damit die Leute weniger Geld ausgeben und die Preise wieder sinken. Das ist schlecht für Unternehmen, weil sie sich teurer Geld leihen müssen, und es ist auch schlecht für Aktien, weil die Gewinne der Unternehmen darunter leiden könnten. Obwohl einige Tech-Aktien heute Morgen wieder etwas gestiegen sind, macht die Sorge um die hohen Preise und mögliche höhere Zinsen den Anlegern insgesamt zu schaffen.","gemini-2.5-flash"
"2026-05-13 18:10:42","USA","SPY","VERKAUFEN","-0.7","100","The Guardian","https://vertexaisearch.cloud.google.com/grounding-api-redirect/AUZIYQF6KsVBeKUSAuSqFKlnRzxvnLkwG0Upwvjz1okNV4p5EMQI9so8yZm2Ct2n63l7hINU--q_4eLbMhxf8u8Z9Zy8ixKvK6n4rDDnEYxjXFanDpjJH3h7H3eIsX_wBInvBp96Mt805qUi6u9XpHErVa0gZHsYEEa-_bIlZVoCzDexpZPsTHbsthLrPsVoE_Dqi5E6IPWJOxtp1ITc5i8Dn5bvmnmjZKdaca9zkgc8ABo122VUZVRWtTcle-RgiREnoFjVDvK_DXcdcUOm","ANALYSE: Die US-Inflation (Verbraucherpreisindex) ist im April 2026 auf 3,8% im Jahresvergleich gestiegen, was die schnellste Rate seit 2023 darstellt und hauptsächlich auf gestiegene Energiekosten infolge des Konflikts im Iran zurückzuführen ist. Dies hat zu einem Anstieg der Renditen von US-Staatsanleihen geführt und die Erwartungen an eine restriktivere Haltung der Federal Reserve, möglicherweise mit einer Zinserhöhung im Jahr 2027, verstärkt. Die asiatischen Aktienmärkte fielen daraufhin, und die US-Aktienindex-Futures gaben nach, wobei insbesondere Chiphersteller einen deutlichen Rückgang verzeichneten.
ERKLÄRUNG FÜR ANFÄNGER: Die Preise für Waren und Dienstleistungen in den USA sind im April stärker gestiegen als erwartet, vor allem weil Benzin und Öl teurer geworden sind, was auch am Konflikt im Iran liegt. Das bedeutet, dass die US-Zentralbank (Fed) möglicherweise die Zinsen erhöhen muss, um die Preise wieder zu senken. Diese Nachricht hat dazu geführt, dass die Aktienkurse an den Börsen, insbesondere in Asien und bei Technologieunternehmen in den USA, gefallen sind.","gemini-2.5-flash"
"2026-05-13 20:09:53","NONE","NONE","IGNORIEREN","0.0","0","NONE","https://vertexaisearch.cloud.google.com/grounding-api-redirect/AUZIYQEZ6_5Fwp-YR_BnIZBYDflKrQ23ktUikKRwGnPtSjBIPjKw-PufdQ-4MOSwGGIZ77G8vMhDADkvif1rrylauUPA9-4bqfhAy74RZBlTHH9GCBiVPHV79XZCRQrwnGeKLRAX1JDubDY2MSsvbZY3fOsle2yhgVoc","ANALYSE: Der globale Finanzmarkt zeigt sich am heutigen Mittwoch, dem 13. Mai 2026, ruhig. Es wurden keine massiven Eilmeldungen, neuen makroökonomischen Daten oder politischen Treiber identifiziert, die eine unmittelbare Marktbewegung auslösen könnten. Die jüngsten wichtigen geldpolitischen Entscheidungen der EZB (Ende April 2026) und der US-Notenbank Fed (April 2026), die ihre Leitzinsen unverändert ließen, sowie die Entscheidung der Bank of Japan (April 2026), die Zinsen ebenfalls stabil zu halten, sind bereits bekannt und in den Märkten eingepreist. Auch die Intervention Japans am Devisenmarkt Anfang Mai zur Stützung des Yen ist ein vergangenes Ereignis. Im Kryptobereich gab es in den letzten Wochen keine neuen, sicherheitsrelevanten Vorfälle oder regulatorischen Urteile, die eine sofortige Reaktion erfordern würden. Kurze, einfache Erklärung für Anfänger: Heute gibt es keine großen, überraschenden Nachrichten an den Börsen weltweit. Die wichtigen Entscheidungen der Zentralbanken über die Zinsen, die in den letzten Wochen getroffen wurden, sind den Anlegern bereits bekannt und haben ihre Wirkung schon entfaltet. Es ist also ein ruhiger Tag ohne neue, große Aufregung an den Finanzmärkten.","gemini-2.5-flash"
"2026-05-13 21:45:12","USA","SPY","VERKAUFEN","-0.7","2744","ftd.de","https://vertexaisearch.cloud.google.com/grounding-api-redirect/AUZIYQGoqc0PryRn8mR1g-X9OFvSlYgEyW7Y-HF6NXjTv2PLqi9-B-2qUs7SjApdacxh0GkmetJRY0cA25ehhCR4xkCdok7zRRTDPlrG5Ks4eVkWT4uYXOKVMfyR6dLJySkFVbN4KV2awYeu_RQOe0TXecB5KMyXYU4wBoM71Is3QHC6I7gvgz4_SUyJ_9BWjFrvFrjBXvq34h4mlPcXkfjHWsZzwACO-TD3613CDdmrzr-QyCYwk4ruPf6nf34YSAnp","ANALYSE: Die US-Inflation ist im April 2026 auf 3,8% gestiegen, was über den Erwartungen von 3,7% lag. Haupttreiber waren die Energiepreise, die im Jahresvergleich um 17,9% zulegten, beeinflusst durch den Iran-Konflikt. Auch die Kerninflation stieg auf 2,8%. Diese Entwicklung verstärkt die Sorgen vor potenziellen Zinserhöhungen durch die Federal Reserve, da die Notenbank ein Inflationsziel von 2% anstrebt. RELEVANZ: Höhere Inflationsraten als erwartet erhöhen den Druck auf die US-Zentralbank, ihre Geldpolitik zu straffen, was sich negativ auf Aktienmärkte auswirken kann, da höhere Zinsen die Kreditkosten für Unternehmen erhöhen und die Konsumausgaben dämpfen können. Für Nicht-Finanzexperten: Die Preise in den USA sind stärker gestiegen als gedacht, besonders für Energie. Das bedeutet, dass die US-Zentralbank möglicherweise die Zinsen erhöhen muss, um die Preissteigerungen zu bremsen. Höhere Zinsen machen es für Unternehmen und Privatpersonen teurer, Geld zu leihen, was die Wirtschaft verlangsamen und die Aktienkurse fallen lassen könnte.","gemini-2.5-flash"
"2026-05-13 22:52:13","USA","SPY","VERKAUFEN","-0.6","120","Investing.com","https://vertexaisearch.cloud.google.com/grounding-api-redirect/AUZIYQGrV0D3jzd94acjvXFSpexODcotwqdbKVaTTaFpOTlOKyId8aQWdJ_jGZ_rhYbbW98YL62wvRUk8qarmYnksvLxxgrNmB39YQGUt-37Jd3Q_cea24_0","ANALYSE: Kevin Warsh wurde als neuer Vorsitzender der Federal Reserve bestätigt, was eine bedeutende Führungsänderung in der US-Zentralbank darstellt. Diese Bestätigung erfolgt inmitten von Bedenken über eine steigende Inflation, die durch einen unerwartet hohen Anstieg des Erzeugerpreisindex (PPI) im April unterstrichen wird. Die US-Energiepreise sind ebenfalls stark gestiegen, was die Inflationssorgen weiter anheizt. Dies könnte auf eine potenzielle Straffung der Geldpolitik hindeuten, um die Preisstabilität zu gewährleisten. RELEVANZ: Eine neue Führung an der Spitze der Fed in einer Phase hoher Inflation ist ein entscheidender makroökonomischer Faktor, der die zukünftige Zinspolitik und damit die Kreditkosten und die Unternehmensgewinne beeinflussen wird. Die Marktstimmung wurde bereits durch die Inflationsdaten gedämpft. Kurze, einfache Erklärung für Anfänger: Der Chef der amerikanischen Zentralbank, der über die Zinsen entscheidet, wurde ausgetauscht. Das passiert, während die Preise für viele Dinge in den USA stark steigen. Es ist möglich, dass der neue Chef die Zinsen erhöhen wird, um die Preissteigerungen zu stoppen. Höhere Zinsen machen Kredite teurer und können das Wirtschaftswachstum bremsen, was für Aktienmärkte oft keine gute Nachricht ist.","gemini-2.5-flash"
"2026-05-13 23:59:46","USA","SPY","IGNORIEREN","0.0","612","WSLS 10","https://vertexaisearch.cloud.google.com/grounding-api-redirect/AUZIYQFg92_x1ByxYBH54F5tcg-JiB41HYsFGIoOn0URgUkmQn088E-3HcHniQ2ck09T_4zHZTrP4dXxE47QE3tQaaiPS9yKXHT0K7b-KH7x4jGI7G_rk4I84ePsdWoT-1CsVqYznYmve_vLuVJ728Via1XyhknSNz7T-WKmYo2bXG_LCDWadtWl","ANALYSE: Die US-Produzentenpreise (PPI) stiegen im April 2026 um 6% gegenüber dem Vorjahr, was deutlich über den Erwartungen lag und auf anhaltenden Inflationsdruck hindeutet. Trotz dieser enttäuschenden Inflationsdaten zeigte sich die Wall Street gemischt; der S&P 500 stieg um 0,6% auf ein neues Rekordhoch, angetrieben von einer Erholung der Technologieaktien, während der Dow Jones leicht nachgab und der Nasdaq ebenfalls ein Rekord erreichte. Diese Entwicklung legt nahe, dass der Markt die Inflationssorgen teilweise durch die Stärke im Technologiesektor ausgleicht, jedoch die Möglichkeit einer Zinserhöhung durch die Federal Reserve im dritten Quartal wieder in den Fokus rückt. Für nicht finanzbewanderte Menschen bedeutet das: Die Preise, die Unternehmen für ihre Produkte zahlen, sind viel stärker gestiegen als gedacht. Normalerweise würde das die Börse belasten, aber die großen US-Aktien, besonders im Technologiebereich, haben trotzdem zugelegt. Das zeigt, dass Anleger trotz der Sorge vor steigenden Preisen weiterhin an Tech-Firmen glauben, aber die US-Notenbank könnte bald die Zinsen erhöhen, um die Inflation zu bekämpfen.","gemini-2.5-flash"
"2026-05-14 06:53:29","EUROPE","EZU","KAUFEN","0.7","4320","theguardian.com/business","https://vertexaisearch.cloud.google.com/grounding-api-redirect/AUZIYQFp5Apw04keKmVPaaVPmcqQ9lYYIPqBjtK7OAC1_M8ZeEY_f76oLzv8AjWDWfTRZQPeUQt0C1rOqqhCmHhCKGgnR7Yti78xoYVYadLH6PO6aixUd7CNeAz11YNnumSC91gpdSacSUioaW6gjxMrHYZ7p8O1Jlr6rBrPkZtXoKBhcp7wxoQAmeobVpptejla2On8zy3-CftXdalecZW0kE4_Cbgj7Y-yNxGvRRT9tDrq7wpaWwwY2wIQkTsf-KFRW0S-t4QK-n_nviSlbL0Y","ANALYSE: Die Europäische Zentralbank (EZB) hat am 11. Mai 2026 ihren Leitzins um einen Viertelpunkt auf 2% gesenkt, was die achte Zinssenkung in Folge darstellt. Diese Maßnahme zielt darauf ab, Unternehmen und Verbraucher durch günstigere Kredite zu unterstützen, insbesondere angesichts der Bedrohung durch den Handelskrieg von US-Präsident Donald Trump. EZB-Präsidentin Christine Lagarde betonte, dass der zukünftige Zinspfad von der Lösung der Handelsspannungen mit den USA abhängt und die EZB sich nicht auf einen bestimmten Kurs festlegt. Die Inflation im Euroraum liegt mit 1,9% unter dem 2%-Ziel der EZB, was Spielraum für diese Lockerung bot. RELEVANZ: Diese Zinssenkung ist ein klares Signal für eine akkommodierende Geldpolitik, die darauf abzielt, das Wirtschaftswachstum in Europa zu stimulieren. Sie könnte europäische Aktien (repräsentiert durch ETFs wie EZU) attraktiver machen, da Unternehmen leichter investieren und expandieren können. ERKLÄRUNG FÜR ANFÄNGER: Stell dir vor, die EZB ist wie eine große Bank für alle Banken in Europa. Wenn sie die Zinsen senkt, wird es für normale Banken billiger, sich Geld zu leihen. Diese Ersparnis geben sie dann an uns weiter, sodass Kredite für Häuser oder Autos günstiger werden. Das soll uns ermutigen, mehr Geld auszugeben und so die Wirtschaft in Schwung bringen.","gemini-2.5-flash"
"2026-05-14 09:36:30","NONE","NONE","IGNORIEREN","0.0","0","NONE","Keine Web-URL indiziert","ANALYSE: Nach einer umfassenden Suche in den vorgegebenen Whitelist-Quellen für die Regionen Asien, Europa, USA und Krypto konnten keine aktuellen, kursrelevanten Eilmeldungen, makroökonomischen Daten oder politischen Treiber identifiziert werden, die ein klares Handelssignal für den heutigen Tag (14. Mai 2026) generieren würden. Einige potenziell relevante Nachrichten bezüglich der EZB-Zinsentscheidungen und Inflationsprognosen für 2026 sowie institutionelle Krypto-Investitionen wurden gefunden, stammten jedoch aus Quellen, die nicht auf der Whitelist stehen, oder waren zeitlich nicht aktuell genug, um als Live-Marktbewegung zu gelten. Daher wird der Markt als ruhig eingestuft, ohne spezifische, bestätigte Nachrichten, die eine sofortige Reaktion erfordern. Für nicht finanzbewanderte Menschen bedeutet dies, dass es derzeit keine großen, neuen Nachrichten gibt, die die Finanzmärkte stark beeinflussen könnten. Es ist ein ruhiger Tag an den Börsen, ohne besondere Ereignisse, die Anlass zur Sorge oder zu schnellen Käufen oder Verkäufen geben würden.","gemini-2.5-flash"
"2026-05-14 11:28:51","EUROPE","EWG","KAUFEN","0.75","208","finanzen.net","https://vertexaisearch.cloud.google.com/grounding-api-redirect/AUZIYQGMhYkTohpGMIJXiElDiZ2OxaN4p7ds3Hz01jQ34KPrf4GxKNMho-NXCSQKGtXWqu-mAO_nhSHXO959UvsGn4DiLrQDrucxUvXV_ZAG1Yf2F9QDpm9NQBArxO2ji4iRGcgySCvxdIE40xS8Q5rX59uusshWqK8=","ANALYSE: Der deutsche Leitindex DAX verzeichnete im Feiertagshandel am Donnerstag deutliche Gewinne und setzte seine Stabilisierung fort. Ein wichtiger Faktor, der von Anlegern beobachtet wird, ist der Besuch von US-Präsident Donald Trump in China. Die positive Entwicklung des DAX deutet auf eine verbesserte Marktstimmung in Europa hin, möglicherweise beeinflusst durch die Erwartung positiver Entwicklungen aus den geopolitischen Gesprächen. RELEVANZ: Diese Nachricht ist kursrelevant, da sie eine aktuelle positive Bewegung an einem der größten europäischen Aktienmärkte zeigt und einen potenziellen makroökonomischen Treiber (Trumps China-Besuch) hervorhebt, der globale Auswirkungen haben könnte. KURZE ERKLÄRUNG FÜR ANFÄNGER: Stell dir vor, der deutsche Aktienmarkt, gemessen am DAX, hat heute kräftig zugelegt. Das ist gut für Anleger, die deutsche Aktien besitzen. Ein Grund dafür könnte sein, dass die Leute gespannt sind, was bei einem wichtigen Treffen zwischen dem US-Präsidenten und China herauskommt, da solche Treffen oft die Weltwirtschaft beeinflussen.","gemini-2.5-flash"
"2026-05-14 13:17:44","USA","SPY","VERKAUFEN","-0.7","1487","Bureau of Labor Statistics","https://vertexaisearch.cloud.google.com/grounding-api-redirect/AUZIYQHPxI365_ZSx7FPCb_UKEZXEQS-m4YeZEGuYYUpHdAEPVlUvq3N8yBcHpNvWL3OtDhQAMdNXtMR6FTIS-liKivRbwwA_X3PW00t6c83N3RC","ANALYSE: Die US-Inflationsdaten für April 2026 zeigen einen Anstieg des Erzeugerpreisindex (PPI) um 1,4% und des Verbraucherpreisindex (CPI) um 0,6%, was einer Jahresrate von 3,8% entspricht. Diese stärker als erwarteten Inflationszahlen haben die Erwartungen an Zinssenkungen der Federal Reserve in diesem Jahr zunichtegemacht und lassen stattdessen eine höhere Wahrscheinlichkeit weiterer Zinserhöhungen vor Jahresende erwarten. Dies belastet die Marktstimmung für risikoreiche Anlagen.
Einfache Erklärung für Anfänger: Die Preise in den USA sind im April stärker gestiegen als gedacht, sowohl für Hersteller als auch für Verbraucher. Das bedeutet, dass die Inflation hartnäckig bleibt. Deshalb glauben die Finanzexperten, dass die amerikanische Zentralbank (Fed) die Zinsen dieses Jahr nicht senken, sondern vielleicht sogar noch erhöhen wird. Das macht Kredite teurer und ist generell schlecht für Aktien und andere Anlagen, die von niedrigen Zinsen profitieren.","gemini-2.5-flash"
"2026-05-14 15:37:15","USA","SPY","VERKAUFEN","-0.7","336","The Guardian","https://vertexaisearch.cloud.google.com/grounding-api-redirect/AUZIYQHsTZ7DndGy02PT4PuigGmJDPOJSzmukLClGd9MAPxOFmvniaQVB8gJVe6m3FleNTV2br_4DSHEsUtP4tHOh5mnjnxX14MtMBMyizasffCSucNx0votonz8RK1HcfwrbvghjhOce60S87eipo-_-kyry7TMZCFZ4vQqtJyZnFuJNrTHj9KgeWO8Ty527B4jy458gG_kO2U8-zz1pLKy9Uyy5QNEdfAqQ_V6GP5OPPeenf4OCJH_A6bCZajZZBp-ppfVb_tkLvntGlA=","ANALYSE: Die US-Inflation hat im April deutlich zugenommen, mit einem jährlichen Verbraucherpreisindex (CPI) von 3,8% und einer annualisierten Dreimonatsrate von 7,1%, was weit über dem 2%-Ziel der Federal Reserve liegt. Der Erzeugerpreisindex (PPI) stieg ebenfalls stark an. Haupttreiber sind die steigenden Energiekosten, insbesondere Benzin, aufgrund des Iran-Krieges. Trotzdem blieb die Arbeitslosenquote stabil bei 4,3%. Diese Inflationsdaten erhöhen den Druck auf die Federal Reserve, eine restriktivere Geldpolitik zu verfolgen, was die Erwartungen an Zinssenkungen im Jahr 2026 dämpfen könnte. Obwohl der US-Aktienmarkt, insbesondere der Technologiesektor, durch KI-Investitionen widerstandsfähig war, deuten die makroökonomischen Daten auf eine mögliche Straffung der Geldpolitik hin.
ERKLÄRUNG FÜR ANFÄNGER: Stell dir vor, die Preise für fast alles in den USA steigen viel schneller als erwartet, besonders Benzin wegen des Krieges im Iran. Das bedeutet, dein Geld ist weniger wert. Die US-Zentralbank (die ""Fed"") hat eigentlich das Ziel, die Preise stabil zu halten. Jetzt, wo die Preise so stark steigen, muss die Fed überlegen, ob sie die Zinsen erhöhen muss, um die Inflation zu bremsen. Das würde Kredite teurer machen und könnte das Wirtschaftswachstum verlangsamen. Obwohl die Börse, besonders Tech-Aktien wie Nvidia, gerade gut läuft, könnte die Fed bald eingreifen müssen, um die steigenden Preise in den Griff zu bekommen.","gemini-2.5-flash"
