"Zeitstempel (UTC)","Region","Ticker","Handlung","Sentiment","Alter (Min)","Quelle","Original-Quelle","Zusammenfassung","KI-Modell"
"2026-05-10 13:39:34","CRYPTO","BTC","KAUFEN","0.7","2109","Reuters","https://vertexaisearch.cloud.google.com/grounding-api-redirect/AUZIYQE9dyJz_Ej72Wmig7sFJOPLT5D6FSe9_-tlMyBPfJhsu5bMg35UCy3wnQQtVmX6oo6sTP5B4n7qBpoBOjKF9FZfXZF5Tel2Ow8ad8sJWLgxUD2y5nZ-7QAnumcabbwZk9KDgkDlNm3N85HUS6r3CDZ7Azoyy1JOza9baSY0dEarKuzP9ZlP0OLBe2c_0cFqzWHk7uO71mOHMlcdfSZCrL55qxs=","ANALYSE: Der CLARITY Act, der einen regulatorischen Rahmen für digitale Vermögenswerte in den USA schaffen soll, wird voraussichtlich vor dem 4. Juli 2026 verabschiedet. Senatoren haben einen überparteilichen Kompromiss zu Stablecoin-Regulierungen erzielt, der Belohnungen für inaktive Stablecoin-Bestände verbietet, aber andere aktivitätsbasierte Belohnungen zulässt. Der Senatsbankenausschuss wird die Gesetzgebung nächste Woche, am 14. Mai, prüfen. Dies stellt einen bedeutenden Schritt zur Schaffung von regulatorischer Klarheit im US-Kryptomarkt dar, was das Vertrauen der Anleger stärken und die institutionelle Adoption fördern könnte. Die Beseitigung langjähriger regulatorischer Unsicherheiten wird als starker positiver Katalysator für den Sektor angesehen.","gemini-2.5-flash"
"2026-05-10 14:09:17","USA","USA Equities","KAUFEN","0.65","3728","seekingalpha.com","https://vertexaisearch.cloud.google.com/grounding-api-redirect/AUZIYQFqMrnLUJrqzpEzf9ETqNwRCUvmpk7X3yPWNgDlqSsX63qvjKNLmmrLWtIY5hyyZ_p0ElX1PeumzSM8uB3G_phVH_CdXk9omNc39ZF1drzus9z-_IMPj_wxcQXRZ6yuI_xI_wB-lEPWMNbWGRDIdOkkk0Taol6OcV1vAeXgowTUENKn23PRQTnAYQ==","ANALYSE: Die US-Aktienmärkte haben am Freitag, dem 8. Mai 2026, neue Rekordhochs erreicht, wobei der S&P 500, der Nasdaq 100 und die US-Small-Caps ihren sechsten bzw. siebten Wochengewinn in Folge verzeichneten. Dies deutet auf eine starke positive Marktstimmung hin, die durch positive Arbeitsmarktdaten gestützt wird. Gleichzeitig gab es Berichte über die Wiederaufnahme von Feindseligkeiten in der Straße von Hormus und Angriffe der USA auf iranische Küstenstellungen, obwohl Donald Trump einen intakten Waffenstillstand betonte. Eine weitere bemerkenswerte Entwicklung ist die Aussage des Weißen Hauses, dass die Federal Reserve die Zinsen aufgrund eines politisch ernannten Fed-Vorsitzenden senken wird, was die Unabhängigkeit der Zentralbank in Frage stellt. Trotz geopolitischer Spannungen und Fragen zur Fed-Unabhängigkeit überwiegt die positive Dynamik der Aktienmärkte. RELEVANZ: Die anhaltende Aufwärtsdynamik der US-Aktienmärkte, die in Rekordhochs mündet, ist ein starkes bullisches Signal für die Eröffnung am Montag. Die geopolitischen Spannungen im Nahen Osten könnten zwar eine gewisse Unsicherheit schaffen, scheinen aber die positive Marktstimmung nicht wesentlich zu trüben. Die Kommentare des Weißen Hauses zur Fed-Politik könnten kurzfristig als positiv für risikoreiche Anlagen interpretiert werden, da sie auf potenzielle Zinssenkungen hindeuten, auch wenn sie langfristig Bedenken hinsichtlich der Zentralbankunabhängigkeit aufwerfen. Kurze, einfache Erklärung für Anfänger: Die US-Börsen sind gerade super stark und haben neue Höchststände erreicht, was bedeutet, dass viele Anleger optimistisch sind. Es gibt zwar Nachrichten über Konflikte im Nahen Osten und eine Diskussion darüber, ob die Regierung die Zentralbank bei Zinsentscheidungen beeinflusst, aber die allgemeine Stimmung an den Aktienmärkten ist sehr positiv.","gemini-2.5-flash"
"2026-05-10 15:31:20","USA","SPY","VERKAUFEN","-0.7","2880","Investing.com","https://vertexaisearch.cloud.google.com/grounding-api-redirect/AUZIYQFQ2wkktW0mKUDYVMAbIieiRgmzTUcwGnQmqRc0UF4BzFCBodh1Lr1Gw--hQ-mtwujU_2Ccl-oxKiczPXKhqAuHuXWBeYbpxGoXo5A9JBYPK8_Cm7jthDqg_bdwVJkEvrcMX0PfyrUhODJOZqqOiYSdeLYCjvx0s-iJmTqfnbA4GLrEqxKa_bHrExUvCR5YaN4Wsix7sTi9M8YKcsfE2mC9UR5ANoE9T2PgpNz9q5KaDTT-J5aJEfk=","ANALYSE: Berichte über eine Verletzung des Waffenstillstands zwischen den USA und dem Iran sowie einen Schusswechsel in der Straße von Hormus am Wochenende haben die geopolitischen Risikoprämien wieder erhöht und die Ölpreise über 95-100 USD pro Barrel getrieben. US-Präsident Trump erklärte, der Waffenstillstand sei intakt, nachdem beide Seiten am Vortag das Feuer ausgetauscht hatten. RELEVANZ: Diese erneuten Spannungen könnten Inflationsängste verstärken und die Erwartungen an Zinssenkungen der Zentralbanken dämpfen, da höhere Ölpreise die globale Wirtschaft belasten. KURZE, EINFACHE ERKLÄRUNG FÜR ANFÄNGER: Stell dir vor, zwei große Länder streiten sich wieder in einer wichtigen Schifffahrtsroute für Öl. Das macht alle nervös, weil es den Ölpreis in die Höhe treiben könnte. Höhere Ölpreise bedeuten, dass alles teurer wird, was wiederum die Zentralbanken dazu bringen könnte, die Zinsen nicht zu senken oder sogar zu erhöhen, um die Inflation zu bekämpfen. Das ist schlecht für die Wirtschaft und die Aktienmärkte.","gemini-2.5-flash"
"2026-05-10 16:34:33","EUROPE","RHM","VERKAUFEN","-0.7","508","BörsenNEWS.de","https://vertexaisearch.cloud.google.com/grounding-api-redirect/AUZIYQFfWGPR1cQj5zf03WmHU8rFaHVtHwhYM_i3UPKwkenMirEb_yWIpjxeKRwyqiXendTncdP0mpjGK5ep5_Q9dBn3Lu5QSj4K_BHO56gJuNSiSwK-FCKqXw==","ANALYSE: Die Aktie des deutschen Rüstungskonzerns Rheinmetall stand am Wochenende massiv unter Druck und verlor an Boden, was auf eine potenziell schwierige Markteröffnung am Montag hindeutet. Der Unterstützungsbereich um 1.320 Euro / 1.300 Euro wurde als kritisch angesehen und stand unter erheblichem Druck. Auch der gesamte DAX stolperte ins Wochenende, wobei weitere Schwergewichte wie SAP und Allianz ebenfalls unter Druck gerieten, während die Commerzbank positive Quartalszahlen meldete.

EINFACHE ERKLÄRUNG: Stell dir vor, eine Aktie ist wie der Preis für ein Stück Kuchen. Wenn viele Leute denken, der Kuchen ist nicht mehr so gut oder es gibt schlechte Nachrichten über die Bäckerei, dann fällt der Preis. Genau das ist am Wochenende mit der Aktie von Rheinmetall passiert: Viele Anzeichen deuten darauf hin, dass der Preis fallen könnte, wenn der Handel am Montag wieder beginnt. Auch der gesamte deutsche Aktienmarkt (DAX) hatte einen schwachen Abschluss vor dem Wochenende.","gemini-2.5-flash"
"2026-05-10 17:35:45","ASIA","NONE","KAUFEN","0.7","1775","channelnewsasia.com","Keine Web-URL indiziert","ANALYSE: Chinas Außenhandel hat im April die Erwartungen deutlich übertroffen. Die Exporte stiegen um 14,1 Prozent und die Importe um 25,3 Prozent im Jahresvergleich. Diese starken Zahlen, die am Samstag veröffentlicht wurden, deuten auf eine robuste Widerstandsfähigkeit der chinesischen Wirtschaft hin, trotz globaler Unsicherheiten. Dies könnte sich positiv auf die asiatischen Märkte zum Wochenstart auswirken. Für Laien bedeutet das: China hat im April viel mehr Waren ins Ausland verkauft und auch mehr eingekauft, als man erwartet hatte. Das ist ein sehr gutes Zeichen dafür, dass die chinesische Wirtschaft stark ist und gut läuft, was den Börsen in Asien am Montag einen Schub geben könnte.","gemini-2.5-flash"
"2026-05-10 18:38:36","CRYPTO","N/A","KAUFEN","0.8","0","The Block, CryptoPotato, News.az","https://vertexaisearch.cloud.google.com/grounding-api-redirect/AUZIYQFJXRGWslKOv1Y_xLntkoZXTSFQzrKLiihWqNoKYglBq3wwlmd6mfv_I08ioVD5n7ki5CUJnyv6YbvqOGQf0tRP6-9ZZUHy-i8kHasj-LZLgfvqGx0-hvQ0jpXy7cwiGrY2hhPjCyYXhsgYper1MNh7aG6HfstFkhyUIqikpOAXVJ7rJB7ZrN_qlLzPf1vqVxTIuNSTP31fwwIpbXh0LygPyaM=","ANALYSE: Ein überparteilicher Kompromiss zum CLARITY Act (Digital Asset Market Clarity Act) wurde am Wochenende erzielt, der eine umfassende Regulierung für Kryptowährungen schaffen soll. Der US-Senat wird das Gesetz voraussichtlich ab dem 14. Mai prüfen. Diese Entwicklung reduziert die rechtliche Unsicherheit für Krypto-Firmen erheblich und beschleunigt die Marktakzeptanz. RELEVANZ: Dies ist eine sehr kursrelevante Nachricht, die bereits eine Rallye im Kryptomarkt ausgelöst hat und voraussichtlich weiteres Vertrauen bei Anlegern schaffen wird. ERKLÄRUNG FÜR ANFÄNGER: Die Regeln für Kryptowährungen werden klarer, was gut für die Akzeptanz ist und den Wert steigen lässt, ähnlich wie wenn ein neues Spiel endlich klare Regeln bekommt und alle mitmachen wollen.","gemini-2.5-flash"
"2026-05-10 19:02:46","CRYPTO","BTC","KAUFEN","0.8","1320","Binance News","https://vertexaisearch.cloud.google.com/grounding-api-redirect/AUZIYQFpf10tx5lmt793e3Be3m4GEu8FYCSHuLPF9cXOfqWsDbGARwhj_59DQXdouSANhdi3EhFi1uGkvCfmBjzxpV12W2dEAl23_c9sKMvexg7bGEGBHETKw9GzDI9M6YvCGX1VB_OGsBvBwyrroMBsi-2B_oeOWU8ifChguqO099hCMLkdp5iYZCaDPHv-PStIcHA2Qb6rLdQQEFi-TO04QpRlOsM_VCe9xlA_hA8IUvnJ7nJKpwvNDt73oqYxBv3Xz2iOjABhh4XVZbS_PpdYvqNy","Der Kryptomarkt zeigte am Freitag, dem 9. Mai 2026, eine starke positive Entwicklung, wobei Altcoins deutlich zulegten und Bitcoin über 80.000 US-Dollar hielt. Diese Dynamik wurde durch eine breite Risikobereitschaft, Rekordhochs an den US-Aktienmärkten, einen robusten US-Arbeitsmarktbericht und positive Signale des SEC-Vorsitzenden Paul Atkins bezüglich der Regulierung von On-Chain-Handelsinfrastrukturen angetrieben. Zudem verzeichneten Spot Bitcoin ETFs in der vergangenen Woche Nettozuflüsse von über 622 Millionen US-Dollar. Für Nicht-Finanzexperten bedeutet dies, dass viele digitale Währungen wie Bitcoin und andere kleinere Kryptowährungen im Wert gestiegen sind, weil die Anleger optimistisch waren, die traditionellen Aktienmärkte gut liefen, viele neue Arbeitsplätze in den USA geschaffen wurden und es Anzeichen für klarere Regeln für den Kryptohandel gab, was das Vertrauen der großen Anleger stärkt.","gemini-2.5-flash"
"2026-05-10 19:45:27","USA","SPY","VERKAUFEN","-0.6","2880","bloomberg.com","https://vertexaisearch.cloud.google.com/grounding-api-redirect/AUZIYQH60ami2xOPi7fpJijR1JMSAVFsVWNS3YHHWPfqPazxX-jiNZ99fTNVthlYhf8l0CwtA8XLwpAfKcOZ01sF28eXKP5qkJ6IvccOiIdHzeHXHhiP2-8UeO1Ldic2KwrPL0Mj0sj3mNk=","ANALYSE: Austan Goolsbee, Präsident der Federal Reserve Bank of Chicago, äußerte sich weniger optimistisch über den Fortschritt bei der Disinflation und stellte fest, dass die Inflation ""schlimmer wird"" und seit fünf Jahren über dem 2%-Ziel liegt. Er betonte, dass die Fed die Inflationsseite ernsthaft prüfen müsse, was auf eine potenziell restriktivere Geldpolitik hindeutet. Gleichzeitig übertraf das US-Arbeitsplatzwachstum im April die Erwartungen, und die Arbeitslosenquote blieb bei 4,3%. Diese Kombination aus hartnäckiger Inflation und einem robusten Arbeitsmarkt könnte den Druck auf die Federal Reserve erhöhen, die Zinsen länger hoch zu halten oder sogar weitere Straffungen in Betracht zu ziehen, was die Aussichten für Aktienmärkte belasten könnte. 

EINFACHE ERKLÄRUNG: Ein wichtiger Vertreter der US-Notenbank (Fed) ist besorgt, dass die Inflation (Preisanstieg) schlimmer wird und schon lange zu hoch ist. Gleichzeitig ist der Arbeitsmarkt sehr stark. Das bedeutet, die Fed könnte die Zinsen länger hochhalten oder sogar weiter erhöhen, um die Preise zu kontrollieren. Das könnte schlecht für Aktien sein, da höhere Zinsen Kredite teurer machen und das Wirtschaftswachstum bremsen können.","gemini-2.5-flash"
"2026-05-10 20:33:14","ASIA","EWJ","IGNORIEREN","0.1","4112","reuters.com","https://vertexaisearch.cloud.google.com/grounding-api-redirect/AUZIYQFpGk4OdY6DHDRzoPu0dBxnYIwwiKedljbXvVv0WMJdRE6Dgzhkr5WxZu8UGgSgTa2FcjhPJnfN92fvhxTGDKXJEynKWq0mkoCSnb7MF8kDqpH8WOF81Oz-sgmYp4lZVj3SCFwwMNDFU8xVM8NFQurEGMlUdsMDHgNQFUgzXzWPQm2otV06CKXJDNdiiMab","ANALYSE: Japans reale Löhne sind im März den dritten Monat in Folge um 1,0 % gestiegen, was den Druck auf die Bank of Japan (BoJ) erhöht, die Zinsen weiter anzuheben. Die nächste Zinsentscheidung der BoJ ist für den 15. und 16. Juni geplant, wobei eine Zinserhöhung auf 1,0 % bis Ende Juni von fast zwei Dritteln der Ökonomen erwartet wird. Diese Entwicklung deutet auf eine straffere Geldpolitik in Japan hin, was den Yen stärken könnte. Für Nicht-Finanzexperten bedeutet das: Die Gehälter in Japan steigen endlich so stark, dass die Menschen sich trotz höherer Preise mehr leisten können. Das ist ein gutes Zeichen für die Wirtschaft. Die japanische Zentralbank könnte daraufhin die Zinsen erhöhen, um die Wirtschaft nicht zu überhitzen. Höhere Zinsen bedeuten, dass Sparen attraktiver wird und Kredite teurer werden.","gemini-2.5-flash"
"2026-05-10 21:32:00","USA","SPY","KAUFEN","0.7","3421","XTB","https://vertexaisearch.cloud.google.com/grounding-api-redirect/AUZIYQExd9f9iBd43iuk62qGPYzpqNeTRBuJiRJGysV_LBklwuF3qU_uVThh8h9G4ymqfPuKIhKXsDdamv651pXBuP5A8EXn8ccDhWt1hlD7aT4LHAXnmGJONH6BX4ZHpbA5VnWPYxlYaxmbd9w-dsi0fgo-GJuP_qHGeZ36VIKr0L4R4YyxbedQAaXzMHJdvnKErJJgLaH42VbE5XH-bTZcTYUiYa5_","ANALYSE: Der US-Arbeitsmarktbericht (Non-Farm Payrolls) für April 2026 übertraf die Erwartungen deutlich, mit einem robusten Stellenaufbau und moderater Lohnentwicklung. Dies signalisiert eine weiterhin widerstandsfähige US-Wirtschaft. Die Finanzmärkte reagierten positiv, und die Erwartungen, dass die Federal Reserve die Zinssätze bis 2027 unverändert lassen könnte, wurden gestärkt. Es gibt jedoch auch Hinweise auf eine gewisse Zurückhaltung bei Neueinstellungen und gemischte Signale aus anderen Arbeitsmarktdaten, was auf ein nuancierteres Bild hindeutet. RELEVANZ: Dieser starke Arbeitsmarktbericht könnte die US-Aktienmärkte am Montag positiv beeinflussen, da er auf eine solide Wirtschaft hindeutet, ohne übermäßigen Inflationsdruck durch Löhne. KURZE, EINFACHE ERKLÄRUNG: Stell dir vor, die Wirtschaft ist ein Motor. Dieser Bericht zeigt, dass der Motor der USA immer noch stark läuft und viele neue Jobs geschaffen werden, ohne dass die Löhne zu schnell steigen. Das ist gut für Unternehmen und Investoren, weil es bedeutet, dass die Zentralbank (Fed) vielleicht nicht so schnell die Zinsen erhöhen muss. Das könnte die Aktienkurse steigen lassen.","gemini-2.5-flash"
"2026-05-10 22:28:45","USA","SPY","VERKAUFEN","-0.7","0","reuters.com","https://vertexaisearch.cloud.google.com/grounding-api-redirect/AUZIYQE6JNvtrHHYL_rzf-1Km37J4xf0Qew7ACbV7pgffTnGBNw7gkB2J9dQgRMJO3QyW9GZqvyZJ7r9qfB2Pb5CdULJDadIBJ6T9CXUaVrAuo7V9LTvFSNrAJ5KTah6CAdgdEs_E-puz5NGFt_1m93XNntvHqEYaVpADsGuFuYYEKXpq1DO0MZ5XvBr6ucMu2oZB3Km6X9oYWW6wWQvRi198Vbt1CF9n8mDFDTIogDbGPVL25GXWcn4Pc-8_U24nw6G-iYMbSDmXiPtxIPNgxshZVhwGXDX","ANALYSE: Der anhaltende Konflikt zwischen den USA und Iran sowie die Blockade der Straße von Hormus führen zu steigenden Rohölpreisen und erhöhten Inflationserwartungen in den USA. Prognosen deuten auf einen Anstieg der Inflation im April und Mai hin, was die Federal Reserve unter Druck setzt, eine restriktivere Geldpolitik beizubehalten oder sogar Zinserhöhungen in Betracht zu ziehen, entgegen früheren Markterwartungen für Zinssenkungen. Dieses Szenario ist generell negativ für Aktienmärkte, da höhere Inflation die Kaufkraft mindert und eine straffere Geldpolitik die Kreditkosten erhöht.

EINFACHE ERKLÄRUNG: Stell dir vor, der Ölpreis steigt stark, weil es im Nahen Osten Ärger gibt und wichtige Schifffahrtswege blockiert sind. Das macht alles teurer, von Benzin bis zu Lebensmitteln. Wenn die Preise zu schnell steigen (Inflation), muss die US-Zentralbank (Fed) möglicherweise die Zinsen erhöhen, um das Geld teurer zu machen und die Wirtschaft zu bremsen. Höhere Zinsen sind schlecht für Unternehmen und Aktien, weil Kredite teurer werden und die Gewinne sinken könnten. Das bedeutet, dass die Aktienmärkte am Montag wahrscheinlich mit fallenden Kursen starten könnten.","gemini-2.5-flash"
"2026-05-10 23:30:51","USA","EWG","VERKAUFEN","-0.7","5730","benzinga.com","https://vertexaisearch.cloud.google.com/grounding-api-redirect/AUZIYQGz0cnLdnQLqilhjwEVRUI02uuzV_SZ8yzD6hAC3XXlLLLrXdJh-3bDRftSVEb-Jl3EXuAdwWJAbs8EhQ1ncpotv8nXJcwnQNILtcN-Nc2W_rEKa8yqM4mxRzdg8_0w0Kzv0yTdPdHnAqN8LesoWMMlkzCS41Z7NpENLH_KxN25uJN-Tm7n0AzNIvwdNYe6MRfBQhqBtxvtYrCrUwIN9I-wEo2sYXKh_BNhFy0jlwH3Fy601g-9q_yRCLlubR008TDqph-O","ANALYSE: US-Präsident Donald Trump hat der Europäischen Union eine Frist bis zum 4. Juli gesetzt, um ein Handelsabkommen zu genehmigen, andernfalls drohen höhere Zölle auf EU-Waren. Diese Ankündigung, die am 7. Mai 2026 erfolgte, stellt eine erhebliche geopolitische und wirtschaftliche Unsicherheit dar, die sich negativ auf europäische Exportunternehmen und damit auf die europäischen Märkte auswirken könnte. Für Laien: Der ehemalige US-Präsident droht Europa mit höheren Importsteuern, wenn kein Handelsvertrag zustande kommt. Das könnte europäische Firmen, die in die USA verkaufen, teurer machen und ihren Gewinn schmälern, was den Wert europäischer Aktien beeinträchtigen könnte.
","gemini-2.5-flash"
